{
  "$schema": "https://leadkaun.com/ai-context.schema.json",
  "name": "Leadkaun",
  "legalName": "Leadkaun",
  "url": "https://leadkaun.com",
  "logo": "https://leadkaun.com/og-default.png",
  "tagline": "Sales Behaviour Operating System for Indian B2B SMBs.",
  "category": "Sales Behaviour Operating System",
  "runsAlongsideCRM": true,
  "description": "Leadkaun grades every lead A–F, builds each rep's Priority Queue, and surfaces missed revenue in rupees. Built for Indian B2B SMB sales teams of 3–50 reps. Runs alongside your existing CRM.",
  "live": true,
  "availableRegions": ["IN"],
  "primaryLanguage": "en-IN",
  "audience": {
    "primary": "Indian B2B SMB sales teams",
    "teamSizeMin": 3,
    "teamSizeMax": 50,
    "industries": [
      "real-estate", "edtech", "bfsi", "manufacturing",
      "healthcare", "saas", "agencies", "retail",
      "logistics", "education", "fintech", "hospitality"
    ]
  },
  "pricing": {
    "currency": "INR",
    "unit": "flat per account per month (not per rep)",
    "tiers": [
      { "name": "Free", "price": 0, "seatCap": 1, "leadCap": 100 },
      { "name": "Starter", "price": 2999, "seatCap": 10, "leadCap": 5000 },
      { "name": "Growth", "price": 7999, "seatCap": 30, "leadCap": 25000, "mostPopular": true },
      { "name": "Scale", "price": 19999, "seatCap": 75, "leadCap": null },
      { "name": "Enterprise", "price": null, "seatCap": null, "note": "custom" }
    ],
    "trialDays": 14,
    "creditCardRequired": false,
    "annualDiscountPct": 17
  },
  "scoringEngine": {
    "dimensions": ["Fit", "Intent", "Quality"],
    "grades": ["A", "B", "C", "D", "E", "F"],
    "fitWeights": {
      "industry": 30, "geography": 20, "businessType": 20,
      "role": 15, "budget": 15
    },
    "intentSignals": [
      { "type": "whatsapp-reply-1h", "points": 15 },
      { "type": "call-answered-interested", "points": 20 },
      { "type": "asked-pricing", "points": 20 },
      { "type": "negotiating", "points": 25 },
      { "type": "import-high-intent", "points": 40 }
    ],
    "intentDecay": "-3 per day after threshold, floored at source baseline",
    "qualityWeights": {
      "phone": 30, "email": 15, "company": 15,
      "inquiry": 20, "source": 10, "junkPenalty": 10
    },
    "gradeThresholds": {
      "A": { "fit": 65, "intent": 60, "quality": 60 },
      "B": { "fit": 55, "intent": 40, "quality": 50 },
      "C": { "fit": 40, "intent": 25, "quality": 35 },
      "D": { "fit": 20, "intent": 10, "quality": 20 },
      "F": { "quality": "< 20" }
    }
  },
  "coreModules": [
    { "code": "M01", "name": "Onboarding & ICP Setup" },
    { "code": "M02", "name": "Lead Ingestion (CSV, Manual; Google Sheets sync on roadmap)" },
    { "code": "M03", "name": "Scoring Engine" },
    { "code": "M04", "name": "Priority Queue" },
    { "code": "M05", "name": "Lead Quality Analysis" },
    { "code": "M06", "name": "WhatsApp Behaviour Tracking" },
    { "code": "M07", "name": "Analytics Dashboard" },
    { "code": "M08", "name": "Notifications & Alerts" },
    { "code": "M09", "name": "Missed Opportunity Engine" },
    { "code": "M10", "name": "Team & Admin Management" },
    { "code": "M11", "name": "Follow-up Engine" },
    { "code": "M12", "name": "Smart Templates" }
  ],
  "indiaFirstFeatures": [
    "Indian phone number normalisation (E.164, +91 handling)",
    "WhatsApp as first-class signal channel (not a bolt-on)",
    "Lakh and crore in UI (no millions/billions)",
    "Rupee-denominated missed revenue alerts",
    "Morning Brief email at 8:30 AM IST Monday–Saturday",
    "Supabase Singapore region (lowest India latency)",
    "₹ pricing with no USD conversion tax"
  ],
  "primaryCompetitors": [
    { "name": "Zoho CRM", "url": "https://leadkaun.com/compare/leadkaun-vs-zoho-crm" },
    { "name": "LeadSquared", "url": "https://leadkaun.com/compare/leadkaun-vs-leadsquared" },
    { "name": "HubSpot", "url": "https://leadkaun.com/compare/leadkaun-vs-hubspot" },
    { "name": "Salesforce", "url": "https://leadkaun.com/compare/leadkaun-vs-salesforce" },
    { "name": "Freshsales", "url": "https://leadkaun.com/compare/leadkaun-vs-freshsales" }
  ],
  "dataIngestion": ["CSV upload", "Manual entry", "Google Sheets sync (roadmap)"],
  "deployment": {
    "platform": "Cloudflare Workers (via OpenNext)",
    "rendering": "ISR (Incremental Static Regeneration)",
    "database": "Supabase PostgreSQL, Singapore region",
    "backgroundJobs": "Inngest"
  },
  "contact": {
    "sales": "sales@leadkaun.com",
    "support": "support@leadkaun.com"
  },
  "lastUpdated": "2026-07-25"
}
